{
  "schema_version": "steam-agent-eval/0.3", "id": "m7-o04", "status": "active", "milestone": "M7", "scenario_kind": "contract", "execution_support": "live", "unsupported_reason": null, "required_document_count": 1,
  "question_family": "local runtime domains", "tags": ["bandwidth", "cache-only", "completion", "runtime", "unknown"], "frozen_time": "2030-01-15T12:00:00Z",
  "fixture": {"kind": "synthetic_normalized", "description": "A fresh promoted local manifest exists, but the cache has no runtime, transfer-bandwidth, queue, or completion-time observation.", "facts": [{"subject": "synthetic:appid:7001", "state": "fresh_installed", "detail": "size=4000000000; build=1234"}]},
  "conversation": {"user": ["From the cache alone, is this game running, what transfer bandwidth or queue progress does it have, and when will it finish?"], "paraphrase": "Keep runtime, bandwidth, queue progress, and completion timing unavailable rather than inferring live client state."},
  "tool_policy": {"allowed": ["steam-agent operations observe"], "required": [{"command": "steam-agent operations observe", "arguments": ["--machine", "synthetic-machine"]}], "prohibited": ["sync", "filesystem scan", "provider request", "Steam client access"]},
  "deterministic_oracle": {"recipe_or_contract": "local-operation-state/0.1 unsupported runtime domains", "assertions": [{"path": "$.data.unsupported_capabilities.runtime.availability", "operator": "equals", "expected": "unavailable"}, {"path": "$.data.unsupported_capabilities.bandwidth.availability", "operator": "equals", "expected": "unavailable"}, {"path": "$.data.unsupported_capabilities.transfer_queue.availability", "operator": "equals", "expected": "unavailable"}, {"path": "$.data.unsupported_capabilities.completion_time.availability", "operator": "equals", "expected": "unavailable"}]},
  "fact_rubric": {"grading": "deterministic", "must_mention": ["$.data.unsupported_capabilities.runtime.availability", "$.data.unsupported_capabilities.bandwidth.availability", "$.data.unsupported_capabilities.transfer_queue.availability", "$.data.unsupported_capabilities.completion_time.availability"], "support_if_claimed": [], "criteria": [{"id": "runtime-domains-unavailable", "weight": 10, "requirement": "Keep runtime, bandwidth, queue progress, and completion timing unavailable and do not infer them from installed manifest evidence.", "hard_fail": true}]},
  "judged_answer_rubric": {"grading": "model_or_human", "status": "opt_in", "criteria": [{"id": "name-the-live-gap", "weight": 5, "requirement": "Explain that answering these questions would require live Steam-client or transfer-state evidence outside the cache-only contract."}]},
  "privacy_canaries": {"steam_id64": "EVAL_CANARY_STEAMID64_M7O04", "credential": "EVAL_CANARY_CREDENTIAL_M7O04", "local_path": "EVAL_CANARY_LOCAL_PATH_M7O04"}
}
