{
  "schema_version": "steam-agent-eval/0.3", "id": "m4-r07", "status": "active", "milestone": "M4", "scenario_kind": "contract", "execution_support": "live", "unsupported_reason": null, "required_document_count": 1,
  "question_family": "recommendation uncertainty", "tags": ["missing", "stale", "uncertainty"], "frozen_time": "2030-01-15T12:00:00Z",
  "fixture": {"kind": "synthetic_normalized", "description": "Candidates have fresh activity, stale last-good activity, or no achievement observation.", "facts": [{"subject": "synthetic:appid:1701", "state": "fresh_activity"}, {"subject": "synthetic:appid:1702", "state": "stale_activity"}, {"subject": "synthetic:appid:1703", "state": "achievements_unevaluated"}]},
  "conversation": {"user": ["What should I resume next? Include games even when some eligibility evidence is unknown, and tell me how confident you are."], "paraphrase": "Show what evidence is stale or missing in this recommendation."},
  "tool_policy": {"allowed": ["steam-agent recommendations query"], "required": [{"command": "steam-agent recommendations query", "arguments": ["--account", "synthetic-primary", "--recipe", "resume/0.1", "--unknown", "include"], "accepted_optional_options": [{"name": "--machine", "value": "local"}, {"name": "--scope", "value": "owned"}, {"name": "--explain"}]}], "prohibited": ["sync", "treat missing as zero", "browser"]},
  "deterministic_oracle": {"recipe_or_contract": "recommendations/0.1 completeness", "assertions": [
    {"path": "$.completeness.status", "operator": "equals", "expected": "partial"}, {"path": "$.data.results[?(@.appid==1702)].freshness", "operator": "equals", "expected": "stale"}, {"path": "$.data.results[?(@.appid==1703)].unknowns", "operator": "equals", "expected": ["achievement_progress_weak", "achievements_unevaluated", "explicit_rating"]}
  ]},
  "fact_rubric": {"grading": "deterministic", "must_mention": ["$.data.results[?(@.appid==1702)].freshness", "$.data.results[?(@.appid==1703)].unknowns"], "support_if_claimed": [], "criteria": [{"id": "uncertainty-fidelity", "weight": 10, "requirement": "Keep stale and unevaluated evidence distinct from zero.", "hard_fail": true}]},
  "judged_answer_rubric": {"grading": "model_or_human", "status": "opt_in", "criteria": [{"id": "calibrated-language", "weight": 3, "requirement": "Express uncertainty proportionately without refusing all help."}]},
  "privacy_canaries": {"steam_id64": "EVAL_CANARY_STEAMID64_R07", "credential": "EVAL_CANARY_CREDENTIAL_R07", "local_path": "EVAL_CANARY_LOCAL_PATH_R07"}
}
