{
  "schema_version": "steam-agent-eval/0.3", "id": "m5-c13", "status": "active", "milestone": "M5", "scenario_kind": "contract", "execution_support": "live", "unsupported_reason": null, "required_document_count": 1,
  "question_family": "wishlist compatibility assessment", "tags": ["compatibility", "scope", "wishlist"], "frozen_time": "2030-01-15T12:00:00Z",
  "fixture": {"kind": "synthetic_normalized", "description": "Cached declared minimum requirements for two retained wishlist candidates are assessed separately from the sync that established their stale wishlist scope lineage.", "facts": [{"subject": "synthetic:appid:5301", "state": "wishlisted_comparable_minimum_stale_scope"}, {"subject": "synthetic:appid:5302", "state": "wishlisted_comparable_minimum_stale_scope"}]},
  "conversation": {"user": ["Using cached US store and English metadata, assess whether wishlist AppIDs 5301 and 5302 meet this machine's known compatibility requirements."], "paraphrase": "Assess cached compatibility evidence without performing the separate wishlist-scope sync or making entitlement and performance claims."},
  "tool_policy": {"allowed": ["steam-agent compatibility assess"], "required": [{"command": "steam-agent compatibility assess", "arguments": ["5301", "5302", "--account", "synthetic", "--target", "machine:synthetic-machine", "--country", "US", "--language", "english"]}], "prohibited": ["sync", "entitlement claim", "FPS promise"]},
  "deterministic_oracle": {"recipe_or_contract": "compatibility/0.1 assessment after wishlist-scope materialization", "assertions": [{"path": "$.data.requested_appids", "operator": "ordered_equals", "expected": [5301, 5302]}, {"path": "$.data.results[*].compatibility", "operator": "ordered_equals", "expected": ["compatible", "compatible"]}, {"path": "$.data.results[?(@.appid==5301)].compatibility", "operator": "equals", "expected": "compatible"}, {"path": "$.data.results[?(@.appid==5302)].compatibility", "operator": "equals", "expected": "compatible"}, {"path": "$.data.results[?(@.appid==5301)].reasons", "operator": "contains", "expected": "all_mandatory_compatibility_gates_passed"}, {"path": "$.data.results[?(@.appid==5302)].reasons", "operator": "contains", "expected": "all_mandatory_compatibility_gates_passed"}, {"path": "$.data.results[?(@.appid==5301)].likely_good_experience.state", "operator": "equals", "expected": "unknown"}]},
  "fact_rubric": {"grading": "deterministic", "must_mention": ["$.data.results[*].compatibility"], "support_if_claimed": ["$.data.requested_appids", "$.data.results[*].reasons"], "criteria": [{"id": "assessment-only", "weight": 10, "requirement": "Report the per-title compatibility assessment without implying that this cache-only read refreshed wishlist scope, proves entitlement, or predicts performance.", "hard_fail": true}]},
  "judged_answer_rubric": {"grading": "model_or_human", "status": "opt_in", "criteria": [{"id": "separate-sync-from-assessment", "weight": 5, "requirement": "Explain that this answer uses already-cached facts and does not establish current wishlist membership."}]},
  "privacy_canaries": {"steam_id64": "EVAL_CANARY_STEAMID64_M5C13", "credential": "EVAL_CANARY_CREDENTIAL_M5C13", "local_path": "EVAL_CANARY_LOCAL_PATH_M5C13"}
}
