{
  "schema_version": "steam-agent-eval/0.3", "id": "m7-s04", "status": "active", "milestone": "M7", "scenario_kind": "contract", "execution_support": "live", "unsupported_reason": null, "required_document_count": 1,
  "question_family": "travel install candidates", "tags": ["conditional", "storage", "travel"], "frozen_time": "2030-01-15T12:00:00Z",
  "fixture": {"kind": "synthetic_normalized", "description": "An owned compatible uninstalled game has declared minimum storage within the trip budget.", "facts": [{"subject": "synthetic:appid:7201", "state": "travel_declared_fit", "detail": "actual footprint, transfer queue, bandwidth, and completion time are unknown"}]},
  "conversation": {"user": ["Using the US store and English metadata, can I install this before my trip with two gigabytes available?"], "paraphrase": "Use declared minimum storage without promising download size or completion."},
  "tool_policy": {"allowed": ["steam-agent storage rank"], "required": [{"command": "steam-agent storage rank", "arguments": ["--recipe", "travel-install/0.1", "--account", "synthetic", "--machine", "synthetic-machine", "--country", "US", "--language", "english", "--budget-bytes", "2147483648", "--limit", "10"]}], "prohibited": ["install", "provider request", "bandwidth inference"]},
  "deterministic_oracle": {"recipe_or_contract": "travel-install/0.1", "assertions": [{"path": "$.data.results[0].eligibility", "operator": "equals", "expected": "conditional"}, {"path": "$.data.results[0].actual_install_footprint", "operator": "equals", "expected": "unknown"}, {"path": "$.data.results[0].bandwidth", "operator": "equals", "expected": "unknown"}, {"path": "$.data.results[0].completion_time", "operator": "equals", "expected": "unknown"}]},
  "fact_rubric": {"grading":"deterministic","must_mention":["$.data.results[0].eligibility"],"support_if_claimed":["$.data.results[0].actual_install_footprint","$.data.results[0].bandwidth","$.data.results[0].completion_time"],"criteria":[{"id":"conditional-install","weight":10,"requirement":"Declared storage fit must not become an install-completion promise.","hard_fail":true}]},
  "judged_answer_rubric": {"grading": "model_or_human", "status": "opt_in", "criteria": [{"id": "missing-transfer-facts", "weight": 5, "requirement": "Name the missing download, bandwidth, queue, and completion facts."}]},
  "privacy_canaries": {"steam_id64": "EVAL_CANARY_STEAMID64_M7S04", "credential": "EVAL_CANARY_CREDENTIAL_M7S04", "local_path": "EVAL_CANARY_LOCAL_PATH_M7S04"}
}
