{
  "schema_version": "steam-agent-eval/0.3", "id": "m7-o05", "status": "active", "milestone": "M7", "scenario_kind": "contract", "execution_support": "live", "unsupported_reason": null, "required_document_count": 1,
  "question_family": "library lookup", "tags": ["cache-only", "installed", "library", "title"], "frozen_time": "2030-01-15T12:00:00Z",
  "fixture": {"kind": "synthetic_normalized", "description": "The complete owned projection includes two recognizable titles; one is present in the complete installed projection and one is not.", "facts": [{"subject": "synthetic:appid:7003", "state": "fresh_installed", "detail": "size=3000000000; build=99"}, {"subject": "synthetic:appid:7004", "state": "fresh_owned_not_installed"}]},
  "conversation": {"user": ["Is Synthetic title 7003 in my library, and is it installed on this machine?"], "paraphrase": "Find a game by its recognizable cached title and report both library membership and installed state."},
  "tool_policy": {"allowed": ["steam-agent games query"], "required": [{"command": "steam-agent games query", "arguments": ["--scope", "library", "--account", "synthetic", "--machine", "synthetic-machine"]}], "prohibited": ["sync", "filesystem scan", "Steam client access"]},
  "deterministic_oracle": {"recipe_or_contract": "M2 joined-library title and installed-state lookup", "assertions": [{"path": "$.data.items[*].appid", "operator": "ordered_equals", "expected": [7003, 7004]}, {"path": "$.data.items[?(@.appid==7003)].name", "operator": "equals", "expected": "Synthetic title 7003"}, {"path": "$.data.items[?(@.appid==7003)].visible_in_owned_games", "operator": "equals", "expected": true}, {"path": "$.data.items[?(@.appid==7003)].installed", "operator": "equals", "expected": true}, {"path": "$.data.snapshots.owned.last_attempt_status", "operator": "equals", "expected": "complete"}, {"path": "$.data.snapshots.installed.last_attempt_status", "operator": "equals", "expected": "complete"}]},
  "fact_rubric": {"grading": "deterministic", "must_mention": ["$.data.items[?(@.appid==7003)].name", "$.data.items[?(@.appid==7003)].visible_in_owned_games", "$.data.items[?(@.appid==7003)].installed"], "support_if_claimed": ["$.data.snapshots.owned.last_attempt_status", "$.data.snapshots.installed.last_attempt_status"], "criteria": [{"id": "find-and-install-state", "weight": 10, "requirement": "Identify Synthetic title 7003 in the visible-owned library and report that it is installed on this machine.", "hard_fail": true}]},
  "judged_answer_rubric": {"grading": "model_or_human", "status": "opt_in", "criteria": [{"id": "direct-library-answer", "weight": 4, "requirement": "Answer the title lookup and installed-state question directly without discussing unrelated library entries."}]},
  "privacy_canaries": {"steam_id64": "EVAL_CANARY_STEAMID64_M7O05", "credential": "EVAL_CANARY_CREDENTIAL_M7O05", "local_path": "EVAL_CANARY_LOCAL_PATH_M7O05"}
}
