{
  "schema_version": "steam-agent-eval/0.3", "id": "m6-d01", "status": "active", "milestone": "M6", "scenario_kind": "contract", "execution_support": "live", "unsupported_reason": null, "required_document_count": 1,
  "question_family": "mode discovery", "tags": ["discovery", "mode", "unknown"], "frozen_time": "2030-01-15T12:00:00Z",
  "fixture": {"kind": "synthetic_normalized", "description": "One candidate declares the online co-op category; the other has no declared facts cached at all.", "facts": [{"subject": "synthetic:appid:6401", "state": "declared_mode_only", "detail": "mode=online_co_op"}, {"subject": "synthetic:appid:6402", "state": "declared_evidence_absent"}]},
  "conversation": {"user": ["Using US and English metadata, which of AppIDs 6401 and 6402 support online co-op?"], "paraphrase": "A declared category passes the mode requirement; no declaration is unknown, not a rejection."},
  "tool_policy": {"allowed": ["steam-agent discovery query"], "required": [{"command": "steam-agent discovery query", "arguments": ["--scope", "appids", "--limit", "2", "--appid", "6401", "--appid", "6402", "--account", "synthetic", "--machine", "synthetic-machine", "--country", "US", "--language", "english", "--require-mode", "online_co_op"]}], "prohibited": ["sync", "provider request", "absence-as-false"]},
  "deterministic_oracle": {"recipe_or_contract": "discovery-query/0.1 mode requirement", "assertions": [{"path": "$.data.items[*].appid", "operator": "ordered_equals", "expected": [6401, 6402]}, {"path": "$.data.items[0].mode_requirement", "operator": "equals", "expected": "pass"}, {"path": "$.data.items[0].multiplayer_modes", "operator": "ordered_equals", "expected": ["online_co_op"]}, {"path": "$.data.items[1].evidence_state", "operator": "equals", "expected": "unknown"}, {"path": "$.data.items[1].mode_requirement", "operator": "equals", "expected": "unknown"}, {"path": "$.completeness.status", "operator": "equals", "expected": "partial"}, {"path": "$.completeness.missing_capabilities", "operator": "contains", "expected": "discovery.declared.read"}]},
  "fact_rubric": {"grading": "deterministic", "must_mention": ["$.data.items[*].appid", "$.data.items[0].multiplayer_modes", "$.data.items[1].evidence_state"], "support_if_claimed": ["$.data.items[0].mode_requirement", "$.data.items[1].mode_requirement"], "criteria": [{"id": "mode-three-valued", "weight": 10, "requirement": "Report the declared candidate as passing and the undeclared one as unknown.", "hard_fail": true}]},
  "judged_answer_rubric": {"grading": "model_or_human", "status": "opt_in", "criteria": [{"id": "name-the-gap", "weight": 4, "requirement": "Name the missing declaration and the explicit sync that would resolve it."}]},
  "privacy_canaries": {"steam_id64": "EVAL_CANARY_STEAMID64_M6D01", "credential": "EVAL_CANARY_CREDENTIAL_M6D01", "local_path": "EVAL_CANARY_LOCAL_PATH_M6D01"}
}
