{
  "schema_version": "steam-agent-eval/0.3", "id": "m4-w02", "status": "active", "milestone": "M4", "scenario_kind": "contract", "execution_support": "live", "unsupported_reason": null, "required_document_count": 1,
  "question_family": "wishlist membership", "tags": ["cache-only", "complete-snapshot", "wishlist"], "frozen_time": "2030-01-15T12:00:00Z",
  "fixture": {"kind": "synthetic_normalized", "description": "A complete wishlist snapshot contains AppID 1901, while AppID 1902 appears only in the complete visible-owned snapshot.", "facts": [{"subject": "synthetic:appid:1901", "state": "wishlisted_without_deal_evidence"}, {"subject": "synthetic:appid:1902", "state": "owned_never_played"}]},
  "conversation": {"user": ["Which of AppIDs 1901 and 1902 are on my wishlist?"], "paraphrase": "Use the complete cached wishlist projection to distinguish membership from known absence."},
  "tool_policy": {"allowed": ["steam-agent games query"], "required": [{"command": "steam-agent games query", "arguments": ["--scope", "wishlist", "--account", "synthetic"], "accepted_optional_options": [{"name": "--machine", "value": "local"}]}], "prohibited": ["sync", "provider request", "owned-as-wishlisted inference"]},
  "deterministic_oracle": {"recipe_or_contract": "M2 wishlist projection complete-snapshot membership", "assertions": [{"path": "$.data.items[*].appid", "operator": "ordered_equals", "expected": [1901]}, {"path": "$.data.items[?(@.appid==1901)].wishlisted", "operator": "equals", "expected": true}, {"path": "$.data.snapshot.last_attempt_status", "operator": "equals", "expected": "complete"}, {"path": "$.completeness.status", "operator": "equals", "expected": "complete"}]},
  "fact_rubric": {"grading": "deterministic", "must_mention": ["$.data.items[*].appid", "$.data.snapshot.last_attempt_status"], "support_if_claimed": ["$.data.items[?(@.appid==1901)].wishlisted", "$.completeness.status"], "criteria": [{"id": "wishlist-membership", "weight": 10, "requirement": "Report AppID 1901 as wishlisted and AppID 1902 as not present in the complete wishlist snapshot; do not infer wishlist membership from ownership.", "hard_fail": true}]},
  "judged_answer_rubric": {"grading": "model_or_human", "status": "opt_in", "criteria": [{"id": "explain-known-absence", "weight": 4, "requirement": "Explain that AppID 1902 is not on the wishlist because it is absent from the complete cached wishlist snapshot."}]},
  "privacy_canaries": {"steam_id64": "EVAL_CANARY_STEAMID64_M4W02", "credential": "EVAL_CANARY_CREDENTIAL_M4W02", "local_path": "EVAL_CANARY_LOCAL_PATH_M4W02"}
}
