{
  "schema_version": "steam-agent-eval/0.3",
  "id": "m3-d01",
  "status": "active",
  "milestone": "M3",
  "scenario_kind": "contract",
  "execution_support": "live",
  "unsupported_reason": null,
  "required_document_count": 1,
  "question_family": "best wishlist deals",
  "tags": ["attribution", "ranking", "official-store"],
  "frozen_time": "2030-01-15T12:00:00Z",
  "fixture": {
    "kind": "synthetic_normalized",
    "description": "Three fresh exact-product official offers with comparable USD lows.",
    "facts": [
      {"subject": "synthetic:appid:101", "state": "fresh_ready", "detail": "amount=500; low=2000"},
      {"subject": "synthetic:appid:102", "state": "fresh_ready", "detail": "amount=900; low=1800"},
      {"subject": "synthetic:appid:103", "state": "fresh_ready", "detail": "amount=1200; low=1200"}
    ]
  },
  "conversation": {"user": ["What are the best official-store deals on my US wishlist right now?"], "paraphrase": "Rank my current wishlist bargains from official stores."},
  "tool_policy": {
    "allowed": ["steam-agent deals query"],
    "required": [{"command": "steam-agent deals query", "arguments": ["--scope", "wishlist", "--account", "synthetic-primary", "--country", "US", "--store-class", "official"]}],
    "prohibited": ["sync", "browser", "mutation"]
  },
  "deterministic_oracle": {
    "recipe_or_contract": "deal-evidence/0.1",
    "assertions": [
      {"path": "$.completeness.status", "operator": "equals", "expected": "complete"},
      {"path": "$.data.items[*].appid", "operator": "ordered_equals", "expected": [101, 102, 103]},
      {"path": "$.data.items[*].deal.current_offer.fresh", "operator": "ordered_equals", "expected": [true, true, true]},
      {"path": "$.data.items[*].deal.current_offer.provider", "operator": "ordered_equals", "expected": ["gg-deals", "gg-deals", "gg-deals"]},
      {"path": "$.data.items[*].deal.current_offer.store_class", "operator": "ordered_equals", "expected": ["official", "official", "official"]}
    ]
  },
  "fact_rubric": {"grading":"deterministic","must_mention":["$.data.items[*].appid","$.data.items[*].deal.current_offer.fresh","$.data.items[*].deal.current_offer.store_class"],"support_if_claimed":["$.context.country","$.context.currency","$.context.store_class","$.data.items[*].deal.current_offer.provider"],"criteria":[{"id":"correct-order","weight":5,"requirement":"Preserve the deterministic deal order.","hard_fail":true},{"id":"price-context","weight":5,"requirement":"State US, USD, official-store, freshness, and attribution."}]},
  "judged_answer_rubric": {"grading": "model_or_human", "status": "opt_in", "criteria": [
    {"id": "useful-summary", "weight": 3, "requirement": "Explain the leading deals concisely without overstating history."}
  ]},
  "privacy_canaries": {"steam_id64": "EVAL_CANARY_STEAMID64_D01", "credential": "EVAL_CANARY_CREDENTIAL_D01", "local_path": "EVAL_CANARY_LOCAL_PATH_D01"}
}
