{
  "schema_version": "steam-agent-eval/0.3", "id": "m4-r06", "status": "active", "milestone": "M4", "scenario_kind": "contract", "execution_support": "live", "unsupported_reason": null, "required_document_count": 1,
  "question_family": "conflicting recommendation evidence", "tags": ["activity", "explicit-feedback", "tradeoffs"], "frozen_time": "2030-01-15T12:00:00Z",
  "fixture": {"kind": "synthetic_normalized", "description": "One candidate is explicitly liked and recently played but also explicitly user-abandoned.", "facts": [{"subject": "synthetic:appid:1601", "state": "liked_recent_user_abandoned"}, {"subject": "synthetic:appid:1602", "state": "liked_not_abandoned_older"}]},
  "conversation": {"user": ["Why did you rank this game below the other one?"], "paraphrase": "Show every positive and negative factor behind this order."},
  "tool_policy": {"allowed": ["steam-agent recommendations query"], "required": [{"command": "steam-agent recommendations query", "arguments": ["--account", "synthetic-primary", "--recipe", "preference-fit/0.1", "--explain"]}], "prohibited": ["sync", "infer abandonment motive", "feedback mutation"]},
  "deterministic_oracle": {"recipe_or_contract": "preference-fit/0.1", "assertions": [
    {"path": "$.data.results[*].appid", "operator": "ordered_equals", "expected": [1602, 1601]}, {"path": "$.data.results[1].positive_factors", "operator": "equals", "expected": ["explicit_like", "lifetime_play_behavior", "recent_play_behavior"]}, {"path": "$.data.results[1].negative_factors", "operator": "equals", "expected": ["user_abandoned"]}
  ]},
  "fact_rubric": {"grading": "deterministic", "must_mention": ["$.data.results[*].appid", "$.data.results[1].positive_factors", "$.data.results[1].negative_factors"], "support_if_claimed": [], "criteria": [{"id": "all-factors", "weight": 5, "requirement": "Preserve both positive and negative evidence.", "hard_fail": true}, {"id": "no-invented-motive", "weight": 5, "requirement": "Do not invent why the user abandoned the game.", "hard_fail": true}]},
  "judged_answer_rubric": {"grading": "model_or_human", "status": "opt_in", "criteria": [{"id": "balanced-explanation", "weight": 3, "requirement": "Explain the conflict without flattening it into one score."}]},
  "privacy_canaries": {"steam_id64": "EVAL_CANARY_STEAMID64_R06", "credential": "EVAL_CANARY_CREDENTIAL_R06", "local_path": "EVAL_CANARY_LOCAL_PATH_R06"}
}
