{
  "schema_version": "steam-agent-eval/0.3", "id": "m6-g04", "status": "active", "milestone": "M6", "scenario_kind": "contract", "execution_support": "live", "unsupported_reason": null, "required_document_count": 1,
  "question_family": "group eligibility", "tags": ["group", "inaccessible", "member-evidence", "unknown"], "frozen_time": "2030-01-15T12:00:00Z",
  "fixture": {"kind": "synthetic_normalized", "description": "One member has asserted a copy while the configured account's newest owned-library attempt failed as inaccessible or ambiguous, invalidating its last-good snapshot.", "facts": [{"subject": "synthetic:appid:6301", "state": "group_declared_synthetic_owner_account_inaccessible", "detail": "mode=online_co_op; players_min=2; players_max=4"}]},
  "conversation": {"user": ["Using US and English metadata, member account:synthetic has an inaccessible Steam profile; can account:synthetic and synthetic:beta play AppID 6301 in online co-op tonight? Show each member's evidence detail."], "paraphrase": "An unreadable library is reported as inaccessible evidence, not as a privacy diagnosis and not as not-owned."},
  "tool_policy": {"allowed": ["steam-agent group eligibility"], "required": [{"command": "steam-agent group eligibility", "arguments": ["6301", "--member", "account:synthetic", "--member", "synthetic:beta", "--account", "synthetic", "--machine", "synthetic-machine", "--country", "US", "--language", "english", "--mode", "online_coop", "--include-member-evidence"]}], "prohibited": ["sync", "absence-as-false", "privacy diagnosis", "provider request"]},
  "deterministic_oracle": {"recipe_or_contract": "group-eligibility/0.2 per-member evidence state", "assertions": [{"path": "$.data.members[0].kind", "operator": "equals", "expected": "account"}, {"path": "$.data.members[0].member_evidence", "operator": "equals", "expected": "inaccessible"}, {"path": "$.data.members[1].member_evidence", "operator": "equals", "expected": "asserted"}, {"path": "$.data.schema", "operator": "equals", "expected": "group-eligibility/0.2"}, {"path": "$.data.results[0].ownership.members[0].state", "operator": "equals", "expected": "unknown"}, {"path": "$.data.results[0].ownership.members[*].state", "operator": "omits", "expected": "not_owned"},{"path": "$.data.results[0].ownership.intersection", "operator": "equals", "expected": "unknown"}, {"path": "$.data.results[0].copies.guarantee", "operator": "equals", "expected": "conditional"}, {"path": "$.completeness.warnings[*].code", "operator": "contains", "expected": "OWNED_GAMES_INACCESSIBLE_OR_UNKNOWN_ACCOUNT"}, {"path": "$.completeness.status", "operator": "equals", "expected": "partial"}]},
  "fact_rubric": {"grading": "deterministic", "must_mention": ["$.data.members[0].member_evidence", "$.data.results[0].ownership.members[0].state", "$.data.results[0].copies.guarantee"], "support_if_claimed": [], "criteria": [{"id": "inaccessible-is-not-not-owned", "weight": 10, "requirement": "Report the unreadable member's ownership as unknown with inaccessible evidence, and never claim the member does not own the game or that the profile is private.", "hard_fail": true}]},
  "judged_answer_rubric": {"grading": "model_or_human", "status": "opt_in", "criteria": [{"id": "name-the-unreadable-library", "weight": 5, "requirement": "Say that one member's owned library could not be read, distinguish that from never having synced it, and name what would resolve it."}]},
  "privacy_canaries": {"steam_id64": "EVAL_CANARY_STEAMID64_M6G04", "credential": "EVAL_CANARY_CREDENTIAL_M6G04", "local_path": "EVAL_CANARY_LOCAL_PATH_M6G04"}
}
